No.     Time           Source                Destination           Protocol Length Info
    101 2.585322669    192.168.1.90          140.82.121.4          TCP      74     47030 → 443 [SYN] Seq=0 Win=64240 Len=0 MSS=1460 SACK_PERM=1 TSval=2610848189 TSecr=0 WS=128

Frame 101: 74 bytes on wire (592 bits), 74 bytes captured (592 bits) on interface wlo1, id 0
Ethernet II, Src: LiteonTe_c5:99:c1 (20:68:9d:c5:99:c1), Dst: Sfr_62:df:48 (e4:5d:51:62:df:48)
    Destination: Sfr_62:df:48 (e4:5d:51:62:df:48)
    Source: LiteonTe_c5:99:c1 (20:68:9d:c5:99:c1)
    Type: IPv4 (0x0800)
Internet Protocol Version 4, Src: 192.168.1.90, Dst: 140.82.121.4
    0100 .... = Version: 4
    .... 0101 = Header Length: 20 bytes (5)
    Differentiated Services Field: 0x00 (DSCP: CS0, ECN: Not-ECT)
    Total Length: 60
    Identification: 0x77e0 (30688)
    Flags: 0x40, Don't fragment
    Fragment Offset: 0
    Time to Live: 64
    Protocol: TCP (6)
    Header Checksum: 0xfb82 [validation disabled]
    [Header checksum status: Unverified]
    Source Address: 192.168.1.90
    Destination Address: 140.82.121.4
Transmission Control Protocol, Src Port: 47030, Dst Port: 443, Seq: 0, Len: 0
    Source Port: 47030
    Destination Port: 443
    [Stream index: 3]
    [TCP Segment Len: 0]
    Sequence Number: 0    (relative sequence number)
    Sequence Number (raw): 4251857310
    [Next Sequence Number: 1    (relative sequence number)]
    Acknowledgment Number: 0
    Acknowledgment number (raw): 0
    1010 .... = Header Length: 40 bytes (10)
    Flags: 0x002 (SYN)
    Window: 64240
    [Calculated window size: 64240]
    Checksum: 0x9fdb [unverified]
    [Checksum Status: Unverified]
    Urgent Pointer: 0
    Options: (20 bytes), Maximum segment size, SACK permitted, Timestamps, No-Operation (NOP), Window scale
    [Timestamps]

No.     Time           Source                Destination           Protocol Length Info
    103 2.629352218    192.168.1.90          140.82.121.4          TCP      66     47030 → 443 [ACK] Seq=1 Ack=1 Win=64256 Len=0 TSval=2610848233 TSecr=4212279596

Frame 103: 66 bytes on wire (528 bits), 66 bytes captured (528 bits) on interface wlo1, id 0
Ethernet II, Src: LiteonTe_c5:99:c1 (20:68:9d:c5:99:c1), Dst: Sfr_62:df:48 (e4:5d:51:62:df:48)
    Destination: Sfr_62:df:48 (e4:5d:51:62:df:48)
    Source: LiteonTe_c5:99:c1 (20:68:9d:c5:99:c1)
    Type: IPv4 (0x0800)
Internet Protocol Version 4, Src: 192.168.1.90, Dst: 140.82.121.4
    0100 .... = Version: 4
    .... 0101 = Header Length: 20 bytes (5)
    Differentiated Services Field: 0x00 (DSCP: CS0, ECN: Not-ECT)
    Total Length: 52
    Identification: 0x77e1 (30689)
    Flags: 0x40, Don't fragment
    Fragment Offset: 0
    Time to Live: 64
    Protocol: TCP (6)
    Header Checksum: 0xfb89 [validation disabled]
    [Header checksum status: Unverified]
    Source Address: 192.168.1.90
    Destination Address: 140.82.121.4
Transmission Control Protocol, Src Port: 47030, Dst Port: 443, Seq: 1, Ack: 1, Len: 0
    Source Port: 47030
    Destination Port: 443
    [Stream index: 3]
    [TCP Segment Len: 0]
    Sequence Number: 1    (relative sequence number)
    Sequence Number (raw): 4251857311
    [Next Sequence Number: 1    (relative sequence number)]
    Acknowledgment Number: 1    (relative ack number)
    Acknowledgment number (raw): 2569117253
    1000 .... = Header Length: 32 bytes (8)
    Flags: 0x010 (ACK)
    Window: 502
    [Calculated window size: 64256]
    [Window size scaling factor: 128]
    Checksum: 0x4bc0 [unverified]
    [Checksum Status: Unverified]
    Urgent Pointer: 0
    Options: (12 bytes), No-Operation (NOP), No-Operation (NOP), Timestamps
    [SEQ/ACK analysis]
    [Timestamps]

No.     Time           Source                Destination           Protocol Length Info
    104 2.632017498    192.168.1.90          140.82.121.4          TLSv1.3  583    Client Hello

Frame 104: 583 bytes on wire (4664 bits), 583 bytes captured (4664 bits) on interface wlo1, id 0
Ethernet II, Src: LiteonTe_c5:99:c1 (20:68:9d:c5:99:c1), Dst: Sfr_62:df:48 (e4:5d:51:62:df:48)
    Destination: Sfr_62:df:48 (e4:5d:51:62:df:48)
    Source: LiteonTe_c5:99:c1 (20:68:9d:c5:99:c1)
    Type: IPv4 (0x0800)
Internet Protocol Version 4, Src: 192.168.1.90, Dst: 140.82.121.4
    0100 .... = Version: 4
    .... 0101 = Header Length: 20 bytes (5)
    Differentiated Services Field: 0x00 (DSCP: CS0, ECN: Not-ECT)
    Total Length: 569
    Identification: 0x77e2 (30690)
    Flags: 0x40, Don't fragment
    Fragment Offset: 0
    Time to Live: 64
    Protocol: TCP (6)
    Header Checksum: 0xf983 [validation disabled]
    [Header checksum status: Unverified]
    Source Address: 192.168.1.90
    Destination Address: 140.82.121.4
Transmission Control Protocol, Src Port: 47030, Dst Port: 443, Seq: 1, Ack: 1, Len: 517
    Source Port: 47030
    Destination Port: 443
    [Stream index: 3]
    [TCP Segment Len: 517]
    Sequence Number: 1    (relative sequence number)
    Sequence Number (raw): 4251857311
    [Next Sequence Number: 518    (relative sequence number)]
    Acknowledgment Number: 1    (relative ack number)
    Acknowledgment number (raw): 2569117253
    1000 .... = Header Length: 32 bytes (8)
    Flags: 0x018 (PSH, ACK)
    Window: 502
    [Calculated window size: 64256]
    [Window size scaling factor: 128]
    Checksum: 0xf68a [unverified]
    [Checksum Status: Unverified]
    Urgent Pointer: 0
    Options: (12 bytes), No-Operation (NOP), No-Operation (NOP), Timestamps
    [SEQ/ACK analysis]
    [Timestamps]
    TCP payload (517 bytes)
Transport Layer Security

No.     Time           Source                Destination           Protocol Length Info
    107 2.685438881    192.168.1.90          140.82.121.4          TCP      66     47030 → 443 [ACK] Seq=518 Ack=1425 Win=64128 Len=0 TSval=2610848289 TSecr=4212279651

Frame 107: 66 bytes on wire (528 bits), 66 bytes captured (528 bits) on interface wlo1, id 0
Ethernet II, Src: LiteonTe_c5:99:c1 (20:68:9d:c5:99:c1), Dst: Sfr_62:df:48 (e4:5d:51:62:df:48)
    Destination: Sfr_62:df:48 (e4:5d:51:62:df:48)
    Source: LiteonTe_c5:99:c1 (20:68:9d:c5:99:c1)
    Type: IPv4 (0x0800)
Internet Protocol Version 4, Src: 192.168.1.90, Dst: 140.82.121.4
    0100 .... = Version: 4
    .... 0101 = Header Length: 20 bytes (5)
    Differentiated Services Field: 0x00 (DSCP: CS0, ECN: Not-ECT)
    Total Length: 52
    Identification: 0x77e3 (30691)
    Flags: 0x40, Don't fragment
    Fragment Offset: 0
    Time to Live: 64
    Protocol: TCP (6)
    Header Checksum: 0xfb87 [validation disabled]
    [Header checksum status: Unverified]
    Source Address: 192.168.1.90
    Destination Address: 140.82.121.4
Transmission Control Protocol, Src Port: 47030, Dst Port: 443, Seq: 518, Ack: 1425, Len: 0
    Source Port: 47030
    Destination Port: 443
    [Stream index: 3]
    [TCP Segment Len: 0]
    Sequence Number: 518    (relative sequence number)
    Sequence Number (raw): 4251857828
    [Next Sequence Number: 518    (relative sequence number)]
    Acknowledgment Number: 1425    (relative ack number)
    Acknowledgment number (raw): 2569118677
    1000 .... = Header Length: 32 bytes (8)
    Flags: 0x010 (ACK)
    Window: 501
    [Calculated window size: 64128]
    [Window size scaling factor: 128]
    Checksum: 0x43bd [unverified]
    [Checksum Status: Unverified]
    Urgent Pointer: 0
    Options: (12 bytes), No-Operation (NOP), No-Operation (NOP), Timestamps
    [SEQ/ACK analysis]
    [Timestamps]

No.     Time           Source                Destination           Protocol Length Info
    109 2.686101931    192.168.1.90          140.82.121.4          TCP      66     47030 → 443 [ACK] Seq=518 Ack=2815 Win=64128 Len=0 TSval=2610848290 TSecr=4212279651

Frame 109: 66 bytes on wire (528 bits), 66 bytes captured (528 bits) on interface wlo1, id 0
Ethernet II, Src: LiteonTe_c5:99:c1 (20:68:9d:c5:99:c1), Dst: Sfr_62:df:48 (e4:5d:51:62:df:48)
    Destination: Sfr_62:df:48 (e4:5d:51:62:df:48)
    Source: LiteonTe_c5:99:c1 (20:68:9d:c5:99:c1)
    Type: IPv4 (0x0800)
Internet Protocol Version 4, Src: 192.168.1.90, Dst: 140.82.121.4
    0100 .... = Version: 4
    .... 0101 = Header Length: 20 bytes (5)
    Differentiated Services Field: 0x00 (DSCP: CS0, ECN: Not-ECT)
    Total Length: 52
    Identification: 0x77e4 (30692)
    Flags: 0x40, Don't fragment
    Fragment Offset: 0
    Time to Live: 64
    Protocol: TCP (6)
    Header Checksum: 0xfb86 [validation disabled]
    [Header checksum status: Unverified]
    Source Address: 192.168.1.90
    Destination Address: 140.82.121.4
Transmission Control Protocol, Src Port: 47030, Dst Port: 443, Seq: 518, Ack: 2815, Len: 0
    Source Port: 47030
    Destination Port: 443
    [Stream index: 3]
    [TCP Segment Len: 0]
    Sequence Number: 518    (relative sequence number)
    Sequence Number (raw): 4251857828
    [Next Sequence Number: 518    (relative sequence number)]
    Acknowledgment Number: 2815    (relative ack number)
    Acknowledgment number (raw): 2569120067
    1000 .... = Header Length: 32 bytes (8)
    Flags: 0x010 (ACK)
    Window: 501
    [Calculated window size: 64128]
    [Window size scaling factor: 128]
    Checksum: 0x3e4e [unverified]
    [Checksum Status: Unverified]
    Urgent Pointer: 0
    Options: (12 bytes), No-Operation (NOP), No-Operation (NOP), Timestamps
    [SEQ/ACK analysis]
    [Timestamps]

No.     Time           Source                Destination           Protocol Length Info
    116 2.743427016    192.168.1.90          140.82.121.4          TLSv1.3  130    Change Cipher Spec, Application Data

Frame 116: 130 bytes on wire (1040 bits), 130 bytes captured (1040 bits) on interface wlo1, id 0
Ethernet II, Src: LiteonTe_c5:99:c1 (20:68:9d:c5:99:c1), Dst: Sfr_62:df:48 (e4:5d:51:62:df:48)
    Destination: Sfr_62:df:48 (e4:5d:51:62:df:48)
    Source: LiteonTe_c5:99:c1 (20:68:9d:c5:99:c1)
    Type: IPv4 (0x0800)
Internet Protocol Version 4, Src: 192.168.1.90, Dst: 140.82.121.4
    0100 .... = Version: 4
    .... 0101 = Header Length: 20 bytes (5)
    Differentiated Services Field: 0x00 (DSCP: CS0, ECN: Not-ECT)
    Total Length: 116
    Identification: 0x77e5 (30693)
    Flags: 0x40, Don't fragment
    Fragment Offset: 0
    Time to Live: 64
    Protocol: TCP (6)
    Header Checksum: 0xfb45 [validation disabled]
    [Header checksum status: Unverified]
    Source Address: 192.168.1.90
    Destination Address: 140.82.121.4
Transmission Control Protocol, Src Port: 47030, Dst Port: 443, Seq: 518, Ack: 2815, Len: 64
    Source Port: 47030
    Destination Port: 443
    [Stream index: 3]
    [TCP Segment Len: 64]
    Sequence Number: 518    (relative sequence number)
    Sequence Number (raw): 4251857828
    [Next Sequence Number: 582    (relative sequence number)]
    Acknowledgment Number: 2815    (relative ack number)
    Acknowledgment number (raw): 2569120067
    1000 .... = Header Length: 32 bytes (8)
    Flags: 0x018 (PSH, ACK)
    Window: 501
    [Calculated window size: 64128]
    [Window size scaling factor: 128]
    Checksum: 0x5c5e [unverified]
    [Checksum Status: Unverified]
    Urgent Pointer: 0
    Options: (12 bytes), No-Operation (NOP), No-Operation (NOP), Timestamps
    [SEQ/ACK analysis]
    [Timestamps]
    TCP payload (64 bytes)
Transport Layer Security

No.     Time           Source                Destination           Protocol Length Info
    117 2.743936536    192.168.1.90          140.82.121.4          TLSv1.3  236    Application Data

Frame 117: 236 bytes on wire (1888 bits), 236 bytes captured (1888 bits) on interface wlo1, id 0
Ethernet II, Src: LiteonTe_c5:99:c1 (20:68:9d:c5:99:c1), Dst: Sfr_62:df:48 (e4:5d:51:62:df:48)
    Destination: Sfr_62:df:48 (e4:5d:51:62:df:48)
    Source: LiteonTe_c5:99:c1 (20:68:9d:c5:99:c1)
    Type: IPv4 (0x0800)
Internet Protocol Version 4, Src: 192.168.1.90, Dst: 140.82.121.4
    0100 .... = Version: 4
    .... 0101 = Header Length: 20 bytes (5)
    Differentiated Services Field: 0x00 (DSCP: CS0, ECN: Not-ECT)
    Total Length: 222
    Identification: 0x77e6 (30694)
    Flags: 0x40, Don't fragment
    Fragment Offset: 0
    Time to Live: 64
    Protocol: TCP (6)
    Header Checksum: 0xfada [validation disabled]
    [Header checksum status: Unverified]
    Source Address: 192.168.1.90
    Destination Address: 140.82.121.4
Transmission Control Protocol, Src Port: 47030, Dst Port: 443, Seq: 582, Ack: 2815, Len: 170
    Source Port: 47030
    Destination Port: 443
    [Stream index: 3]
    [TCP Segment Len: 170]
    Sequence Number: 582    (relative sequence number)
    Sequence Number (raw): 4251857892
    [Next Sequence Number: 752    (relative sequence number)]
    Acknowledgment Number: 2815    (relative ack number)
    Acknowledgment number (raw): 2569120067
    1000 .... = Header Length: 32 bytes (8)
    Flags: 0x018 (PSH, ACK)
    Window: 501
    [Calculated window size: 64128]
    [Window size scaling factor: 128]
    Checksum: 0xda56 [unverified]
    [Checksum Status: Unverified]
    Urgent Pointer: 0
    Options: (12 bytes), No-Operation (NOP), No-Operation (NOP), Timestamps
    [SEQ/ACK analysis]
    [Timestamps]
    TCP payload (170 bytes)
Transport Layer Security

No.     Time           Source                Destination           Protocol Length Info
    118 2.743965720    192.168.1.90          140.82.121.4          TLSv1.3  607    Application Data

Frame 118: 607 bytes on wire (4856 bits), 607 bytes captured (4856 bits) on interface wlo1, id 0
Ethernet II, Src: LiteonTe_c5:99:c1 (20:68:9d:c5:99:c1), Dst: Sfr_62:df:48 (e4:5d:51:62:df:48)
    Destination: Sfr_62:df:48 (e4:5d:51:62:df:48)
    Source: LiteonTe_c5:99:c1 (20:68:9d:c5:99:c1)
    Type: IPv4 (0x0800)
Internet Protocol Version 4, Src: 192.168.1.90, Dst: 140.82.121.4
    0100 .... = Version: 4
    .... 0101 = Header Length: 20 bytes (5)
    Differentiated Services Field: 0x00 (DSCP: CS0, ECN: Not-ECT)
    Total Length: 593
    Identification: 0x77e7 (30695)
    Flags: 0x40, Don't fragment
    Fragment Offset: 0
    Time to Live: 64
    Protocol: TCP (6)
    Header Checksum: 0xf966 [validation disabled]
    [Header checksum status: Unverified]
    Source Address: 192.168.1.90
    Destination Address: 140.82.121.4
Transmission Control Protocol, Src Port: 47030, Dst Port: 443, Seq: 752, Ack: 2815, Len: 541
    Source Port: 47030
    Destination Port: 443
    [Stream index: 3]
    [TCP Segment Len: 541]
    Sequence Number: 752    (relative sequence number)
    Sequence Number (raw): 4251858062
    [Next Sequence Number: 1293    (relative sequence number)]
    Acknowledgment Number: 2815    (relative ack number)
    Acknowledgment number (raw): 2569120067
    1000 .... = Header Length: 32 bytes (8)
    Flags: 0x018 (PSH, ACK)
    Window: 501
    [Calculated window size: 64128]
    [Window size scaling factor: 128]
    Checksum: 0xe142 [unverified]
    [Checksum Status: Unverified]
    Urgent Pointer: 0
    Options: (12 bytes), No-Operation (NOP), No-Operation (NOP), Timestamps
    [SEQ/ACK analysis]
    [Timestamps]
    TCP payload (541 bytes)
Transport Layer Security

No.     Time           Source                Destination           Protocol Length Info
    122 2.789865951    192.168.1.90          140.82.121.4          TCP      66     47030 → 443 [ACK] Seq=1293 Ack=2894 Win=64128 Len=0 TSval=2610848393 TSecr=4212279757

Frame 122: 66 bytes on wire (528 bits), 66 bytes captured (528 bits) on interface wlo1, id 0
Ethernet II, Src: LiteonTe_c5:99:c1 (20:68:9d:c5:99:c1), Dst: Sfr_62:df:48 (e4:5d:51:62:df:48)
    Destination: Sfr_62:df:48 (e4:5d:51:62:df:48)
    Source: LiteonTe_c5:99:c1 (20:68:9d:c5:99:c1)
    Type: IPv4 (0x0800)
Internet Protocol Version 4, Src: 192.168.1.90, Dst: 140.82.121.4
    0100 .... = Version: 4
    .... 0101 = Header Length: 20 bytes (5)
    Differentiated Services Field: 0x00 (DSCP: CS0, ECN: Not-ECT)
    Total Length: 52
    Identification: 0x77e8 (30696)
    Flags: 0x40, Don't fragment
    Fragment Offset: 0
    Time to Live: 64
    Protocol: TCP (6)
    Header Checksum: 0xfb82 [validation disabled]
    [Header checksum status: Unverified]
    Source Address: 192.168.1.90
    Destination Address: 140.82.121.4
Transmission Control Protocol, Src Port: 47030, Dst Port: 443, Seq: 1293, Ack: 2894, Len: 0
    Source Port: 47030
    Destination Port: 443
    [Stream index: 3]
    [TCP Segment Len: 0]
    Sequence Number: 1293    (relative sequence number)
    Sequence Number (raw): 4251858603
    [Next Sequence Number: 1293    (relative sequence number)]
    Acknowledgment Number: 2894    (relative ack number)
    Acknowledgment number (raw): 2569120146
    1000 .... = Header Length: 32 bytes (8)
    Flags: 0x010 (ACK)
    Window: 501
    [Calculated window size: 64128]
    [Window size scaling factor: 128]
    Checksum: 0x3a27 [unverified]
    [Checksum Status: Unverified]
    Urgent Pointer: 0
    Options: (12 bytes), No-Operation (NOP), No-Operation (NOP), Timestamps
    [SEQ/ACK analysis]
    [Timestamps]

No.     Time           Source                Destination           Protocol Length Info
    124 2.790396401    192.168.1.90          140.82.121.4          TCP      66     47030 → 443 [ACK] Seq=1293 Ack=2973 Win=64128 Len=0 TSval=2610848394 TSecr=4212279757

Frame 124: 66 bytes on wire (528 bits), 66 bytes captured (528 bits) on interface wlo1, id 0
Ethernet II, Src: LiteonTe_c5:99:c1 (20:68:9d:c5:99:c1), Dst: Sfr_62:df:48 (e4:5d:51:62:df:48)
    Destination: Sfr_62:df:48 (e4:5d:51:62:df:48)
    Source: LiteonTe_c5:99:c1 (20:68:9d:c5:99:c1)
    Type: IPv4 (0x0800)
Internet Protocol Version 4, Src: 192.168.1.90, Dst: 140.82.121.4
    0100 .... = Version: 4
    .... 0101 = Header Length: 20 bytes (5)
    Differentiated Services Field: 0x00 (DSCP: CS0, ECN: Not-ECT)
    Total Length: 52
    Identification: 0x77e9 (30697)
    Flags: 0x40, Don't fragment
    Fragment Offset: 0
    Time to Live: 64
    Protocol: TCP (6)
    Header Checksum: 0xfb81 [validation disabled]
    [Header checksum status: Unverified]
    Source Address: 192.168.1.90
    Destination Address: 140.82.121.4
Transmission Control Protocol, Src Port: 47030, Dst Port: 443, Seq: 1293, Ack: 2973, Len: 0
    Source Port: 47030
    Destination Port: 443
    [Stream index: 3]
    [TCP Segment Len: 0]
    Sequence Number: 1293    (relative sequence number)
    Sequence Number (raw): 4251858603
    [Next Sequence Number: 1293    (relative sequence number)]
    Acknowledgment Number: 2973    (relative ack number)
    Acknowledgment number (raw): 2569120225
    1000 .... = Header Length: 32 bytes (8)
    Flags: 0x010 (ACK)
    Window: 501
    [Calculated window size: 64128]
    [Window size scaling factor: 128]
    Checksum: 0x39d7 [unverified]
    [Checksum Status: Unverified]
    Urgent Pointer: 0
    Options: (12 bytes), No-Operation (NOP), No-Operation (NOP), Timestamps
    [SEQ/ACK analysis]
    [Timestamps]

No.     Time           Source                Destination           Protocol Length Info
    126 2.792073423    192.168.1.90          140.82.121.4          TCP      66     47030 → 443 [ACK] Seq=1293 Ack=3031 Win=64128 Len=0 TSval=2610848396 TSecr=4212279759

Frame 126: 66 bytes on wire (528 bits), 66 bytes captured (528 bits) on interface wlo1, id 0
Ethernet II, Src: LiteonTe_c5:99:c1 (20:68:9d:c5:99:c1), Dst: Sfr_62:df:48 (e4:5d:51:62:df:48)
    Destination: Sfr_62:df:48 (e4:5d:51:62:df:48)
    Source: LiteonTe_c5:99:c1 (20:68:9d:c5:99:c1)
    Type: IPv4 (0x0800)
Internet Protocol Version 4, Src: 192.168.1.90, Dst: 140.82.121.4
    0100 .... = Version: 4
    .... 0101 = Header Length: 20 bytes (5)
    Differentiated Services Field: 0x00 (DSCP: CS0, ECN: Not-ECT)
    Total Length: 52
    Identification: 0x77ea (30698)
    Flags: 0x40, Don't fragment
    Fragment Offset: 0
    Time to Live: 64
    Protocol: TCP (6)
    Header Checksum: 0xfb80 [validation disabled]
    [Header checksum status: Unverified]
    Source Address: 192.168.1.90
    Destination Address: 140.82.121.4
Transmission Control Protocol, Src Port: 47030, Dst Port: 443, Seq: 1293, Ack: 3031, Len: 0
    Source Port: 47030
    Destination Port: 443
    [Stream index: 3]
    [TCP Segment Len: 0]
    Sequence Number: 1293    (relative sequence number)
    Sequence Number (raw): 4251858603
    [Next Sequence Number: 1293    (relative sequence number)]
    Acknowledgment Number: 3031    (relative ack number)
    Acknowledgment number (raw): 2569120283
    1000 .... = Header Length: 32 bytes (8)
    Flags: 0x010 (ACK)
    Window: 501
    [Calculated window size: 64128]
    [Window size scaling factor: 128]
    Checksum: 0x3999 [unverified]
    [Checksum Status: Unverified]
    Urgent Pointer: 0
    Options: (12 bytes), No-Operation (NOP), No-Operation (NOP), Timestamps
    [SEQ/ACK analysis]
    [Timestamps]

No.     Time           Source                Destination           Protocol Length Info
    127 2.792157096    192.168.1.90          140.82.121.4          TLSv1.3  97     Application Data

Frame 127: 97 bytes on wire (776 bits), 97 bytes captured (776 bits) on interface wlo1, id 0
Ethernet II, Src: LiteonTe_c5:99:c1 (20:68:9d:c5:99:c1), Dst: Sfr_62:df:48 (e4:5d:51:62:df:48)
    Destination: Sfr_62:df:48 (e4:5d:51:62:df:48)
    Source: LiteonTe_c5:99:c1 (20:68:9d:c5:99:c1)
    Type: IPv4 (0x0800)
Internet Protocol Version 4, Src: 192.168.1.90, Dst: 140.82.121.4
    0100 .... = Version: 4
    .... 0101 = Header Length: 20 bytes (5)
    Differentiated Services Field: 0x00 (DSCP: CS0, ECN: Not-ECT)
    Total Length: 83
    Identification: 0x77eb (30699)
    Flags: 0x40, Don't fragment
    Fragment Offset: 0
    Time to Live: 64
    Protocol: TCP (6)
    Header Checksum: 0xfb60 [validation disabled]
    [Header checksum status: Unverified]
    Source Address: 192.168.1.90
    Destination Address: 140.82.121.4
Transmission Control Protocol, Src Port: 47030, Dst Port: 443, Seq: 1293, Ack: 3031, Len: 31
    Source Port: 47030
    Destination Port: 443
    [Stream index: 3]
    [TCP Segment Len: 31]
    Sequence Number: 1293    (relative sequence number)
    Sequence Number (raw): 4251858603
    [Next Sequence Number: 1324    (relative sequence number)]
    Acknowledgment Number: 3031    (relative ack number)
    Acknowledgment number (raw): 2569120283
    1000 .... = Header Length: 32 bytes (8)
    Flags: 0x018 (PSH, ACK)
    Window: 501
    [Calculated window size: 64128]
    [Window size scaling factor: 128]
    Checksum: 0x7f9e [unverified]
    [Checksum Status: Unverified]
    Urgent Pointer: 0
    Options: (12 bytes), No-Operation (NOP), No-Operation (NOP), Timestamps
    [SEQ/ACK analysis]
    [Timestamps]
    TCP payload (31 bytes)
Transport Layer Security

No.     Time           Source                Destination           Protocol Length Info
    136 3.505003859    192.168.1.90          140.82.121.4          TCP      66     47030 → 443 [ACK] Seq=1324 Ack=4423 Win=64128 Len=0 TSval=2610849109 TSecr=4212280471

Frame 136: 66 bytes on wire (528 bits), 66 bytes captured (528 bits) on interface wlo1, id 0
Ethernet II, Src: LiteonTe_c5:99:c1 (20:68:9d:c5:99:c1), Dst: Sfr_62:df:48 (e4:5d:51:62:df:48)
    Destination: Sfr_62:df:48 (e4:5d:51:62:df:48)
    Source: LiteonTe_c5:99:c1 (20:68:9d:c5:99:c1)
    Type: IPv4 (0x0800)
Internet Protocol Version 4, Src: 192.168.1.90, Dst: 140.82.121.4
    0100 .... = Version: 4
    .... 0101 = Header Length: 20 bytes (5)
    Differentiated Services Field: 0x00 (DSCP: CS0, ECN: Not-ECT)
    Total Length: 52
    Identification: 0x77ec (30700)
    Flags: 0x40, Don't fragment
    Fragment Offset: 0
    Time to Live: 64
    Protocol: TCP (6)
    Header Checksum: 0xfb7e [validation disabled]
    [Header checksum status: Unverified]
    Source Address: 192.168.1.90
    Destination Address: 140.82.121.4
Transmission Control Protocol, Src Port: 47030, Dst Port: 443, Seq: 1324, Ack: 4423, Len: 0
    Source Port: 47030
    Destination Port: 443
    [Stream index: 3]
    [TCP Segment Len: 0]
    Sequence Number: 1324    (relative sequence number)
    Sequence Number (raw): 4251858634
    [Next Sequence Number: 1324    (relative sequence number)]
    Acknowledgment Number: 4423    (relative ack number)
    Acknowledgment number (raw): 2569121675
    1000 .... = Header Length: 32 bytes (8)
    Flags: 0x010 (ACK)
    Window: 501
    [Calculated window size: 64128]
    [Window size scaling factor: 128]
    Checksum: 0x2e79 [unverified]
    [Checksum Status: Unverified]
    Urgent Pointer: 0
    Options: (12 bytes), No-Operation (NOP), No-Operation (NOP), Timestamps
    [SEQ/ACK analysis]
    [Timestamps]

No.     Time           Source                Destination           Protocol Length Info
    138 3.507937797    192.168.1.90          140.82.121.4          TCP      66     47030 → 443 [ACK] Seq=1324 Ack=5815 Win=64128 Len=0 TSval=2610849111 TSecr=4212280471

Frame 138: 66 bytes on wire (528 bits), 66 bytes captured (528 bits) on interface wlo1, id 0
Ethernet II, Src: LiteonTe_c5:99:c1 (20:68:9d:c5:99:c1), Dst: Sfr_62:df:48 (e4:5d:51:62:df:48)
    Destination: Sfr_62:df:48 (e4:5d:51:62:df:48)
    Source: LiteonTe_c5:99:c1 (20:68:9d:c5:99:c1)
    Type: IPv4 (0x0800)
Internet Protocol Version 4, Src: 192.168.1.90, Dst: 140.82.121.4
    0100 .... = Version: 4
    .... 0101 = Header Length: 20 bytes (5)
    Differentiated Services Field: 0x00 (DSCP: CS0, ECN: Not-ECT)
    Total Length: 52
    Identification: 0x77ed (30701)
    Flags: 0x40, Don't fragment
    Fragment Offset: 0
    Time to Live: 64
    Protocol: TCP (6)
    Header Checksum: 0xfb7d [validation disabled]
    [Header checksum status: Unverified]
    Source Address: 192.168.1.90
    Destination Address: 140.82.121.4
Transmission Control Protocol, Src Port: 47030, Dst Port: 443, Seq: 1324, Ack: 5815, Len: 0
    Source Port: 47030
    Destination Port: 443
    [Stream index: 3]
    [TCP Segment Len: 0]
    Sequence Number: 1324    (relative sequence number)
    Sequence Number (raw): 4251858634
    [Next Sequence Number: 1324    (relative sequence number)]
    Acknowledgment Number: 5815    (relative ack number)
    Acknowledgment number (raw): 2569123067
    1000 .... = Header Length: 32 bytes (8)
    Flags: 0x010 (ACK)
    Window: 501
    [Calculated window size: 64128]
    [Window size scaling factor: 128]
    Checksum: 0x2907 [unverified]
    [Checksum Status: Unverified]
    Urgent Pointer: 0
    Options: (12 bytes), No-Operation (NOP), No-Operation (NOP), Timestamps
    [SEQ/ACK analysis]
    [Timestamps]

No.     Time           Source                Destination           Protocol Length Info
    140 3.509379518    192.168.1.90          140.82.121.4          TCP      66     47030 → 443 [ACK] Seq=1324 Ack=7239 Win=64128 Len=0 TSval=2610849113 TSecr=4212280471

Frame 140: 66 bytes on wire (528 bits), 66 bytes captured (528 bits) on interface wlo1, id 0
Ethernet II, Src: LiteonTe_c5:99:c1 (20:68:9d:c5:99:c1), Dst: Sfr_62:df:48 (e4:5d:51:62:df:48)
    Destination: Sfr_62:df:48 (e4:5d:51:62:df:48)
    Source: LiteonTe_c5:99:c1 (20:68:9d:c5:99:c1)
    Type: IPv4 (0x0800)
Internet Protocol Version 4, Src: 192.168.1.90, Dst: 140.82.121.4
    0100 .... = Version: 4
    .... 0101 = Header Length: 20 bytes (5)
    Differentiated Services Field: 0x00 (DSCP: CS0, ECN: Not-ECT)
    Total Length: 52
    Identification: 0x77ee (30702)
    Flags: 0x40, Don't fragment
    Fragment Offset: 0
    Time to Live: 64
    Protocol: TCP (6)
    Header Checksum: 0xfb7c [validation disabled]
    [Header checksum status: Unverified]
    Source Address: 192.168.1.90
    Destination Address: 140.82.121.4
Transmission Control Protocol, Src Port: 47030, Dst Port: 443, Seq: 1324, Ack: 7239, Len: 0
    Source Port: 47030
    Destination Port: 443
    [Stream index: 3]
    [TCP Segment Len: 0]
    Sequence Number: 1324    (relative sequence number)
    Sequence Number (raw): 4251858634
    [Next Sequence Number: 1324    (relative sequence number)]
    Acknowledgment Number: 7239    (relative ack number)
    Acknowledgment number (raw): 2569124491
    1000 .... = Header Length: 32 bytes (8)
    Flags: 0x010 (ACK)
    Window: 501
    [Calculated window size: 64128]
    [Window size scaling factor: 128]
    Checksum: 0x2375 [unverified]
    [Checksum Status: Unverified]
    Urgent Pointer: 0
    Options: (12 bytes), No-Operation (NOP), No-Operation (NOP), Timestamps
    [SEQ/ACK analysis]
    [Timestamps]

No.     Time           Source                Destination           Protocol Length Info
    142 3.509507159    192.168.1.90          140.82.121.4          TCP      66     47030 → 443 [ACK] Seq=1324 Ack=8147 Win=63232 Len=0 TSval=2610849113 TSecr=4212280471

Frame 142: 66 bytes on wire (528 bits), 66 bytes captured (528 bits) on interface wlo1, id 0
Ethernet II, Src: LiteonTe_c5:99:c1 (20:68:9d:c5:99:c1), Dst: Sfr_62:df:48 (e4:5d:51:62:df:48)
    Destination: Sfr_62:df:48 (e4:5d:51:62:df:48)
    Source: LiteonTe_c5:99:c1 (20:68:9d:c5:99:c1)
    Type: IPv4 (0x0800)
Internet Protocol Version 4, Src: 192.168.1.90, Dst: 140.82.121.4
    0100 .... = Version: 4
    .... 0101 = Header Length: 20 bytes (5)
    Differentiated Services Field: 0x00 (DSCP: CS0, ECN: Not-ECT)
    Total Length: 52
    Identification: 0x77ef (30703)
    Flags: 0x40, Don't fragment
    Fragment Offset: 0
    Time to Live: 64
    Protocol: TCP (6)
    Header Checksum: 0xfb7b [validation disabled]
    [Header checksum status: Unverified]
    Source Address: 192.168.1.90
    Destination Address: 140.82.121.4
Transmission Control Protocol, Src Port: 47030, Dst Port: 443, Seq: 1324, Ack: 8147, Len: 0
    Source Port: 47030
    Destination Port: 443
    [Stream index: 3]
    [TCP Segment Len: 0]
    Sequence Number: 1324    (relative sequence number)
    Sequence Number (raw): 4251858634
    [Next Sequence Number: 1324    (relative sequence number)]
    Acknowledgment Number: 8147    (relative ack number)
    Acknowledgment number (raw): 2569125399
    1000 .... = Header Length: 32 bytes (8)
    Flags: 0x010 (ACK)
    Window: 494
    [Calculated window size: 63232]
    [Window size scaling factor: 128]
    Checksum: 0x1ff0 [unverified]
    [Checksum Status: Unverified]
    Urgent Pointer: 0
    Options: (12 bytes), No-Operation (NOP), No-Operation (NOP), Timestamps
    [SEQ/ACK analysis]
    [Timestamps]

No.     Time           Source                Destination           Protocol Length Info
    144 3.509563347    192.168.1.90          140.82.121.4          TCP      66     47030 → 443 [ACK] Seq=1324 Ack=9539 Win=61952 Len=0 TSval=2610849113 TSecr=4212280471

Frame 144: 66 bytes on wire (528 bits), 66 bytes captured (528 bits) on interface wlo1, id 0
Ethernet II, Src: LiteonTe_c5:99:c1 (20:68:9d:c5:99:c1), Dst: Sfr_62:df:48 (e4:5d:51:62:df:48)
    Destination: Sfr_62:df:48 (e4:5d:51:62:df:48)
    Source: LiteonTe_c5:99:c1 (20:68:9d:c5:99:c1)
    Type: IPv4 (0x0800)
Internet Protocol Version 4, Src: 192.168.1.90, Dst: 140.82.121.4
    0100 .... = Version: 4
    .... 0101 = Header Length: 20 bytes (5)
    Differentiated Services Field: 0x00 (DSCP: CS0, ECN: Not-ECT)
    Total Length: 52
    Identification: 0x77f0 (30704)
    Flags: 0x40, Don't fragment
    Fragment Offset: 0
    Time to Live: 64
    Protocol: TCP (6)
    Header Checksum: 0xfb7a [validation disabled]
    [Header checksum status: Unverified]
    Source Address: 192.168.1.90
    Destination Address: 140.82.121.4
Transmission Control Protocol, Src Port: 47030, Dst Port: 443, Seq: 1324, Ack: 9539, Len: 0
    Source Port: 47030
    Destination Port: 443
    [Stream index: 3]
    [TCP Segment Len: 0]
    Sequence Number: 1324    (relative sequence number)
    Sequence Number (raw): 4251858634
    [Next Sequence Number: 1324    (relative sequence number)]
    Acknowledgment Number: 9539    (relative ack number)
    Acknowledgment number (raw): 2569126791
    1000 .... = Header Length: 32 bytes (8)
    Flags: 0x010 (ACK)
    Window: 484
    [Calculated window size: 61952]
    [Window size scaling factor: 128]
    Checksum: 0x1a8a [unverified]
    [Checksum Status: Unverified]
    Urgent Pointer: 0
    Options: (12 bytes), No-Operation (NOP), No-Operation (NOP), Timestamps
    [SEQ/ACK analysis]
    [Timestamps]

No.     Time           Source                Destination           Protocol Length Info
    146 3.509616098    192.168.1.90          140.82.121.4          TCP      66     47030 → 443 [ACK] Seq=1324 Ack=10963 Win=60544 Len=0 TSval=2610849113 TSecr=4212280471

Frame 146: 66 bytes on wire (528 bits), 66 bytes captured (528 bits) on interface wlo1, id 0
Ethernet II, Src: LiteonTe_c5:99:c1 (20:68:9d:c5:99:c1), Dst: Sfr_62:df:48 (e4:5d:51:62:df:48)
    Destination: Sfr_62:df:48 (e4:5d:51:62:df:48)
    Source: LiteonTe_c5:99:c1 (20:68:9d:c5:99:c1)
    Type: IPv4 (0x0800)
Internet Protocol Version 4, Src: 192.168.1.90, Dst: 140.82.121.4
    0100 .... = Version: 4
    .... 0101 = Header Length: 20 bytes (5)
    Differentiated Services Field: 0x00 (DSCP: CS0, ECN: Not-ECT)
    Total Length: 52
    Identification: 0x77f1 (30705)
    Flags: 0x40, Don't fragment
    Fragment Offset: 0
    Time to Live: 64
    Protocol: TCP (6)
    Header Checksum: 0xfb79 [validation disabled]
    [Header checksum status: Unverified]
    Source Address: 192.168.1.90
    Destination Address: 140.82.121.4
Transmission Control Protocol, Src Port: 47030, Dst Port: 443, Seq: 1324, Ack: 10963, Len: 0
    Source Port: 47030
    Destination Port: 443
    [Stream index: 3]
    [TCP Segment Len: 0]
    Sequence Number: 1324    (relative sequence number)
    Sequence Number (raw): 4251858634
    [Next Sequence Number: 1324    (relative sequence number)]
    Acknowledgment Number: 10963    (relative ack number)
    Acknowledgment number (raw): 2569128215
    1000 .... = Header Length: 32 bytes (8)
    Flags: 0x010 (ACK)
    Window: 473
    [Calculated window size: 60544]
    [Window size scaling factor: 128]
    Checksum: 0x1505 [unverified]
    [Checksum Status: Unverified]
    Urgent Pointer: 0
    Options: (12 bytes), No-Operation (NOP), No-Operation (NOP), Timestamps
    [SEQ/ACK analysis]
    [Timestamps]

No.     Time           Source                Destination           Protocol Length Info
    148 3.510625572    192.168.1.90          140.82.121.4          TCP      66     47030 → 443 [ACK] Seq=1324 Ack=12323 Win=64128 Len=0 TSval=2610849114 TSecr=4212280471

Frame 148: 66 bytes on wire (528 bits), 66 bytes captured (528 bits) on interface wlo1, id 0
Ethernet II, Src: LiteonTe_c5:99:c1 (20:68:9d:c5:99:c1), Dst: Sfr_62:df:48 (e4:5d:51:62:df:48)
    Destination: Sfr_62:df:48 (e4:5d:51:62:df:48)
    Source: LiteonTe_c5:99:c1 (20:68:9d:c5:99:c1)
    Type: IPv4 (0x0800)
Internet Protocol Version 4, Src: 192.168.1.90, Dst: 140.82.121.4
    0100 .... = Version: 4
    .... 0101 = Header Length: 20 bytes (5)
    Differentiated Services Field: 0x00 (DSCP: CS0, ECN: Not-ECT)
    Total Length: 52
    Identification: 0x77f2 (30706)
    Flags: 0x40, Don't fragment
    Fragment Offset: 0
    Time to Live: 64
    Protocol: TCP (6)
    Header Checksum: 0xfb78 [validation disabled]
    [Header checksum status: Unverified]
    Source Address: 192.168.1.90
    Destination Address: 140.82.121.4
Transmission Control Protocol, Src Port: 47030, Dst Port: 443, Seq: 1324, Ack: 12323, Len: 0
    Source Port: 47030
    Destination Port: 443
    [Stream index: 3]
    [TCP Segment Len: 0]
    Sequence Number: 1324    (relative sequence number)
    Sequence Number (raw): 4251858634
    [Next Sequence Number: 1324    (relative sequence number)]
    Acknowledgment Number: 12323    (relative ack number)
    Acknowledgment number (raw): 2569129575
    1000 .... = Header Length: 32 bytes (8)
    Flags: 0x010 (ACK)
    Window: 501
    [Calculated window size: 64128]
    [Window size scaling factor: 128]
    Checksum: 0x0f98 [unverified]
    [Checksum Status: Unverified]
    Urgent Pointer: 0
    Options: (12 bytes), No-Operation (NOP), No-Operation (NOP), Timestamps
    [SEQ/ACK analysis]
    [Timestamps]

No.     Time           Source                Destination           Protocol Length Info
    150 3.511854608    192.168.1.90          140.82.121.4          TCP      66     47030 → 443 [ACK] Seq=1324 Ack=13747 Win=64128 Len=0 TSval=2610849115 TSecr=4212280471

Frame 150: 66 bytes on wire (528 bits), 66 bytes captured (528 bits) on interface wlo1, id 0
Ethernet II, Src: LiteonTe_c5:99:c1 (20:68:9d:c5:99:c1), Dst: Sfr_62:df:48 (e4:5d:51:62:df:48)
    Destination: Sfr_62:df:48 (e4:5d:51:62:df:48)
    Source: LiteonTe_c5:99:c1 (20:68:9d:c5:99:c1)
    Type: IPv4 (0x0800)
Internet Protocol Version 4, Src: 192.168.1.90, Dst: 140.82.121.4
    0100 .... = Version: 4
    .... 0101 = Header Length: 20 bytes (5)
    Differentiated Services Field: 0x00 (DSCP: CS0, ECN: Not-ECT)
    Total Length: 52
    Identification: 0x77f3 (30707)
    Flags: 0x40, Don't fragment
    Fragment Offset: 0
    Time to Live: 64
    Protocol: TCP (6)
    Header Checksum: 0xfb77 [validation disabled]
    [Header checksum status: Unverified]
    Source Address: 192.168.1.90
    Destination Address: 140.82.121.4
Transmission Control Protocol, Src Port: 47030, Dst Port: 443, Seq: 1324, Ack: 13747, Len: 0
    Source Port: 47030
    Destination Port: 443
    [Stream index: 3]
    [TCP Segment Len: 0]
    Sequence Number: 1324    (relative sequence number)
    Sequence Number (raw): 4251858634
    [Next Sequence Number: 1324    (relative sequence number)]
    Acknowledgment Number: 13747    (relative ack number)
    Acknowledgment number (raw): 2569130999
    1000 .... = Header Length: 32 bytes (8)
    Flags: 0x010 (ACK)
    Window: 501
    [Calculated window size: 64128]
    [Window size scaling factor: 128]
    Checksum: 0x0a07 [unverified]
    [Checksum Status: Unverified]
    Urgent Pointer: 0
    Options: (12 bytes), No-Operation (NOP), No-Operation (NOP), Timestamps
    [SEQ/ACK analysis]
    [Timestamps]

No.     Time           Source                Destination           Protocol Length Info
    152 3.512007026    192.168.1.90          140.82.121.4          TCP      66     47030 → 443 [ACK] Seq=1324 Ack=15171 Win=62848 Len=0 TSval=2610849116 TSecr=4212280471

Frame 152: 66 bytes on wire (528 bits), 66 bytes captured (528 bits) on interface wlo1, id 0
Ethernet II, Src: LiteonTe_c5:99:c1 (20:68:9d:c5:99:c1), Dst: Sfr_62:df:48 (e4:5d:51:62:df:48)
    Destination: Sfr_62:df:48 (e4:5d:51:62:df:48)
    Source: LiteonTe_c5:99:c1 (20:68:9d:c5:99:c1)
    Type: IPv4 (0x0800)
Internet Protocol Version 4, Src: 192.168.1.90, Dst: 140.82.121.4
    0100 .... = Version: 4
    .... 0101 = Header Length: 20 bytes (5)
    Differentiated Services Field: 0x00 (DSCP: CS0, ECN: Not-ECT)
    Total Length: 52
    Identification: 0x77f4 (30708)
    Flags: 0x40, Don't fragment
    Fragment Offset: 0
    Time to Live: 64
    Protocol: TCP (6)
    Header Checksum: 0xfb76 [validation disabled]
    [Header checksum status: Unverified]
    Source Address: 192.168.1.90
    Destination Address: 140.82.121.4
Transmission Control Protocol, Src Port: 47030, Dst Port: 443, Seq: 1324, Ack: 15171, Len: 0
    Source Port: 47030
    Destination Port: 443
    [Stream index: 3]
    [TCP Segment Len: 0]
    Sequence Number: 1324    (relative sequence number)
    Sequence Number (raw): 4251858634
    [Next Sequence Number: 1324    (relative sequence number)]
    Acknowledgment Number: 15171    (relative ack number)
    Acknowledgment number (raw): 2569132423
    1000 .... = Header Length: 32 bytes (8)
    Flags: 0x010 (ACK)
    Window: 491
    [Calculated window size: 62848]
    [Window size scaling factor: 128]
    Checksum: 0x0480 [unverified]
    [Checksum Status: Unverified]
    Urgent Pointer: 0
    Options: (12 bytes), No-Operation (NOP), No-Operation (NOP), Timestamps
    [SEQ/ACK analysis]
    [Timestamps]

No.     Time           Source                Destination           Protocol Length Info
